<?xml version="1.0" encoding="UTF-8"?>
<medicins xmlns:xsi="http://www.w3.org/2001/XMLSchema-instance"
          xmlns="http://www.example.com/medicins"
          xsi:schemaLocation="http://www.example.com/medicins medicins.xsd">
    <medicine medicineId="A0000000001" recipeStatusNeeded="true">
        <name>Humuletine</name>
        <organisationName>DPV44</organisationName>
        <group>ANALGESICS</group>
        <analogs>Retrolog,Ocunide,Demelinum</analogs>
        <version>TABLET</version>
        <issueDate>2012-09-09</issueDate>
        <expirationDate>2020-02-05</expirationDate>
        <registerOrganisationName>STUDOID</registerOrganisationName>
        <package>
            <packageType>BOTTLES</packageType>
            <amount>100</amount>
            <price>25</price>
        </package>
        <dosage>
            <dosageAmount>100</dosageAmount>
            <frequency>
                <days>7</days>
                <perDay>3</perDay>
            </frequency>
        </dosage>
    </medicine>
    <medicine medicineId="A0000000002" recipeStatusNeeded="true">
        <name>Liosulin</name>
        <organisationName>DPV44</organisationName>
        <group>ANALGESICS</group>
        <analogs></analogs>
        <version>TABLET</version>
        <issueDate>2012-09-09</issueDate>
        <expirationDate>2020-02-05</expirationDate>
        <registerOrganisationName>STUDOID</registerOrganisationName>
        <package>
            <packageType>BOTTLES</packageType>
            <amount>100</amount>
            <price>25</price>
        </package>
        <dosage>
            <dosageAmount>100</dosageAmount>
            <frequency>
                <days>7</days>
                <perDay>3</perDay>
            </frequency>
        </dosage>
    </medicine>
    <medicine medicineId="A0000000003" recipeStatusNeeded="true">
        <name>Diazeprazole</name>
        <organisationName>DPV44</organisationName>
        <group>ANALGESICS</group>
        <analogs>Sanctupen,Omebax</analogs>
        <version>TABLET</version>
        <issueDate>2012-09-09</issueDate>
        <expirationDate>2020-02-05</expirationDate>
        <registerOrganisationName>STUDOID</registerOrganisationName>
        <package>
            <packageType>BOTTLES</packageType>
            <amount>100</amount>
            <price>25</price>
        </package>
        <dosage>
            <dosageAmount>100</dosageAmount>
            <frequency>
                <days>7</days>
                <perDay>3</perDay>
            </frequency>
        </dosage>
    </medicine>
    <medicine medicineId="A0000000004" recipeStatusNeeded="true">
        <name>Humuphine</name>
        <organisationName>DPV44</organisationName>
        <group>ANALGESICS</group>
        <analogs>Retrolog,Ocunide,Demelinum</analogs>
        <version>TABLET</version>
        <issueDate>2012-09-09</issueDate>
        <expirationDate>2020-02-05</expirationDate>
        <registerOrganisationName>STUDOID</registerOrganisationName>
        <package>
            <packageType>BOTTLES</packageType>
            <amount>100</amount>
            <price>25</price>
        </package>
        <dosage>
            <dosageAmount>100</dosageAmount>
            <frequency>
                <days>7</days>
                <perDay>3</perDay>
            </frequency>
        </dosage>
    </medicine>
    <medicine medicineId="A0000000005" recipeStatusNeeded="true">
        <name>Sanctunitol</name>
        <organisationName>DPV44</organisationName>
        <group>ANALGESICS</group>
        <analogs>Retrolog,Ocunide,Demelinum</analogs>
        <version>TABLET</version>
        <issueDate>2012-09-09</issueDate>
        <expirationDate>2020-02-05</expirationDate>
        <registerOrganisationName>STUDOID</registerOrganisationName>
        <package>
            <packageType>BOTTLES</packageType>
            <amount>100</amount>
            <price>25</price>
        </package>
        <dosage>
            <dosageAmount>100</dosageAmount>
            <frequency>
                <days>7</days>
                <perDay>3</perDay>
            </frequency>
        </dosage>
    </medicine>
    <medicine medicineId="A0000000006" recipeStatusNeeded="true">
        <name>Aldofranil</name>
        <organisationName>DPV44</organisationName>
        <group>ANALGESICS</group>
        <analogs>Retrolog,Ocunide,Demelinum</analogs>
        <version>TABLET</version>
        <issueDate>2012-09-09</issueDate>
        <expirationDate>2020-02-05</expirationDate>
        <registerOrganisationName>STUDOID</registerOrganisationName>
        <package>
            <packageType>BOTTLES</packageType>
            <amount>100</amount>
            <price>25</price>
        </package>
        <dosage>
            <dosageAmount>100</dosageAmount>
            <frequency>
                <days>7</days>
                <perDay>3</perDay>
            </frequency>
        </dosage>
    </medicine>
    <medicine medicineId="A0000000007" recipeStatusNeeded="true">
        <name>Carbitaine</name>
        <organisationName>DPV44</organisationName>
        <group>ANALGESICS</group>
        <analogs>Retrolog,Ocunide,Demelinum</analogs>
        <version>TABLET</version>
        <issueDate>2012-09-09</issueDate>
        <expirationDate>2020-02-05</expirationDate>
        <registerOrganisationName>STUDOID</registerOrganisationName>
        <package>
            <packageType>BOTTLES</packageType>
            <amount>100</amount>
            <price>25</price>
        </package>
        <dosage>
            <dosageAmount>100</dosageAmount>
            <frequency>
                <days>7</days>
                <perDay>3</perDay>
            </frequency>
        </dosage>
    </medicine>
    <medicine medicineId="A0000000008" recipeStatusNeeded="true">
        <name>Prepaban Azapitant</name>
        <organisationName>DPV44</organisationName>
        <group>ANALGESICS</group>
        <analogs>Retrolog,Ocunide,Demelinum</analogs>
        <version>TABLET</version>
        <issueDate>2012-09-09</issueDate>
        <expirationDate>2020-02-05</expirationDate>
        <registerOrganisationName>STUDOID</registerOrganisationName>
        <package>
            <packageType>BOTTLES</packageType>
            <amount>100</amount>
            <price>25</price>
        </package>
        <dosage>
            <dosageAmount>100</dosageAmount>
            <frequency>
                <days>7</days>
                <perDay>3</perDay>
            </frequency>
        </dosage>
    </medicine>
    <medicine medicineId="A0000000009" recipeStatusNeeded="true">
        <name>Olsatriene Fragpan</name>
        <organisationName>DPV44</organisationName>
        <group>ANALGESICS</group>
        <analogs>Retrolog,Ocunide,Demelinum</analogs>
        <version>TABLET</version>
        <issueDate>2012-09-09</issueDate>
        <expirationDate>2020-02-05</expirationDate>
        <registerOrganisationName>STUDOID</registerOrganisationName>
        <package>
            <packageType>BOTTLES</packageType>
            <amount>100</amount>
            <price>25</price>
        </package>
        <dosage>
            <dosageAmount>100</dosageAmount>
            <frequency>
                <days>7</days>
                <perDay>3</perDay>
            </frequency>
        </dosage>
    </medicine>
    <medicine medicineId="A0000000010" recipeStatusNeeded="true">
        <name>Protopen Acebugestrel</name>
        <organisationName>DPV44</organisationName>
        <group>ANALGESICS</group>
        <analogs>Retrolog,Ocunide,Demelinum</analogs>
        <version>TABLET</version>
        <issueDate>2012-09-09</issueDate>
        <expirationDate>2020-02-05</expirationDate>
        <registerOrganisationName>STUDOID</registerOrganisationName>
        <package>
            <packageType>BOTTLES</packageType>
            <amount>100</amount>
            <price>25</price>
        </package>
        <dosage>
            <dosageAmount>100</dosageAmount>
            <frequency>
                <days>7</days>
                <perDay>3</perDay>
            </frequency>
        </dosage>
    </medicine>
    <medicine medicineId="A0000000011" recipeStatusNeeded="true">
        <name>Abinase</name>
        <organisationName>DPV44</organisationName>
        <group>ANALGESICS</group>
        <analogs>Retrolog,Ocunide,Demelinum</analogs>
        <version>TABLET</version>
        <issueDate>2012-09-09</issueDate>
        <expirationDate>2020-02-05</expirationDate>
        <registerOrganisationName>STUDOID</registerOrganisationName>
        <package>
            <packageType>BOTTLES</packageType>
            <amount>100</amount>
            <price>25</price>
        </package>
        <dosage>
            <dosageAmount>100</dosageAmount>
            <frequency>
                <days>7</days>
                <perDay>3</perDay>
            </frequency>
        </dosage>
    </medicine>
    <medicine medicineId="A0000000012" recipeStatusNeeded="true">
        <name>Duratate</name>
        <organisationName>DPV44</organisationName>
        <group>ANALGESICS</group>
        <analogs>Retrolog,Ocunide,Demelinum</analogs>
        <version>TABLET</version>
        <issueDate>2012-09-09</issueDate>
        <expirationDate>2020-02-05</expirationDate>
        <registerOrganisationName>STUDOID</registerOrganisationName>
        <package>
            <packageType>BOTTLES</packageType>
            <amount>100</amount>
            <price>25</price>
        </package>
        <dosage>
            <dosageAmount>100</dosageAmount>
            <frequency>
                <days>7</days>
                <perDay>3</perDay>
            </frequency>
        </dosage>
    </medicine>